[
  {
    "kind": "required",
    "purpose": "Read the run contract",
    "phase": "initialization",
    "invocation_order": 1,
    "host_requirement": "codex-app",
    "permission_scope": ["read"],
    "expected_evidence": ["resolved capability record"],
    "fallback": null,
    "capability": {"id": "allinluna-run", "type": "skill"}
  },
  {
    "kind": "preferred",
    "purpose": "Create an isolated owner task",
    "phase": "dispatch",
    "invocation_order": 2,
    "host_requirement": "codex-app",
    "permission_scope": ["task:create"],
    "expected_evidence": ["thread id"],
    "fallback": null,
    "capability": {"id": "codex_app__create_thread", "type": "mcp"}
  }
]
